,Unnamed: 0,statnNm,rating,review,review_count
18,18,숙대입구역,4.0,"Pub Stay on the back of Sukdae Station \ N Kozel Cinnamon Black Beer and Steak Lunch is so delicious. \ N \ npub stay!It is the subway station that is the same after the opening of the 20111154 Line. \ N It is very aging.It would be nice to proceed with the remodeling quickly.If you get off at Seoul National University Station, you have to walk to Seoul National University.There is an old restaurant around.There are many restaurants in the back.Sukdae Station Station No. 3 4 Exit 4.Stay/Convenient/Sookmyung Women's University/Subway Station/Surrounding is a great, lively and relatively peaceful atmosphere.There are many chicken shops that open the door late, and there are street food street vendors and pubs around.There are many convenience stores around.The subway station that connects Seoul Station and Incheon Airport is common.GS25 has seats, warm foods, and microwave ovens.The food price is also cheaper and the locals are the favorite place.There are many restaurants, India, China, and Thai food can be eaten as a domino, and KFC can be eaten here in KFC and Domino.Indian restaurants can also be found here, so don't worry about what food you like in Seoul.You can taste all kinds of food.There is a Google map problem in Seoul alone.The map is not a walking route, but the car and bus train paths are displayed, so you can select the location and go to the final destination according to the current location.It's clean and not particularly deep, so it's not too long to come in and out of the time/Good people/It's not the worst, but it's an ordinary subway station./It looks cool",58
19,19,삼각지역,3.9,"It is a subway station in Yongsan Triangle. \ N4 and Line 6 are transfer stations. \ N13 exit has a presidential office.There is a lot of weather. The subway \ n is cool. Line 4 and 6 transfer \ n is clean and convenient.I think it would have been difficult/I think there is this information in the triangular subway station.There are many restaurants around the lines, and office workers are attracted.The interior of the station is clean and exhibits with these pictures, so you can see the leisurely view of the subway.Keep in mind when you go to Line 6, depending on the way you go to the end of the way, if you go to the end, don't panic, you can go back without returning.It's a bit big, but it's just a subway station.Historical place (War Memorial ????)…/Like/The transit passage is too long/historical reverse triangle area is a station where Line 4 and Line 6 meet.The transit passage is longer than I thought, so it is a role that requires the trouble of transfer.There are war memorials and presidential offices around the triangle station.The history itself is old, but it is comfortable because it is well managed.And the history is clean./Pyongyang's house is famous ~ \ n is with the committee.~~ ^^/The triangle is Line 4/Triangle Area (Line 4)/Subway Station/Subway Station TTT/Thirty -year regular House ^^Very clean/very cozy area, everything around is very clean and there is a playground.There is a park and the Korean War Museum nearby.There are many restaurants, hops, cafes, karaoke rooms, etc.It is convenient to move to City Hall and Itaewon.Subway line 2 intersection.How to move Seoul inexpensively and easily!/Clean and convenient.The transfer time of Line 4 and 6 takes about 5 minutes.Another is Noksapyeong.??…/The closest subway station in the War Memorial/Just Subway Station./ Normal!/Excellent Chicken Soup",76
20,20,신용산역,4.1,"There is no transfer of Shin Yongsan Station (Line 4) and bus and subway can be transferred.Isn't it forced to transfer to the culmination?I would like to make use of the convenience of more users.There is an e-market downstairs, you can leave your child to the children's room (20 minutes to 10 hours), there are many clothes stores, there are bookstores/libraries, and there are places to travel around.Although it is a neighboring station, it is a neighbor with Yongsan Station, but it is not a transfer.There is a passage that is directly connected to the Pacific office building, there are many office and restaurants around, and there are many high -rise buildings and many restaurants in the basement.I have been using it. \ N I remember it was inconvenient that I couldn't go out to the entrance to the frequent exit construction.However, when it is connected to the high -rise building and leaves the station, it feels like it is in the middle of Gangnam.Similar to the subway station on Line 4.Nothing special/really good.If you are a gourmet, there is a little distance from the subway/Yongsan station on Line 4, but \ nIf you fall down, you are on your nose/Very good!",49
21,21,이촌역,4.3,"To go to the National Museum, get off at Ichon Station on Line 4.You can also get off here to use the Gyeongui Central Line.Transportation is a very convenient place.But the moving walk to there is slow.Just walking faster/Somewhat older History Line 4 and Gyeongui -seon are cold, indoors. It is good to wait/wide and can be immediately through the museum \ N4, it can be difficult to change the Gyeongui -Jungang Line/Yongsan Station to Ichon StationIt took time to wait at Yongsan Station to go to the Gyeongui Central Line and to wait for Yongsan Station to Yongsan Station.The Gyeongui Central Line/Line 4 and the Central Line of the Gyeongju Line crossed the central museum.The changing line is short, it's not frustrating because it's not frustrating, but it's a bit complicated, but it's a good idea to find it.There was no./ This is where the National Museum is located here. Many students come here./# Ichon Station #Gyeongui Line Deokso LuckThe Dink/Gyeongui Central Line is open, so it is cold in winter./ It is difficult to transfer the Jungang Line 4/Transfer/Gyeongui Line.There is a very good park near the Korean Museum.The museum can be entered free of charge.Clean with a clear sign.There is an elevator auxiliary passage that leads to the museum, which is very high (saving some energy to explore the museum).The National Museum of Korea and the National Hangul Museum are located several steps from the station.Very convenient/Ichon Station is a very comfortable and easy train for foreign customers.You can easily go anywhere without speaking English.Thank you./Please take me to the National Museum/Not bad/The very large stadium of the Hangul Park and the Museum/this Sunway is directly connected to the National Museum of Korea./Amazing/good place/good/good",13
22,22,동작역,4.0,"It is a station that can use Line 4 and 9 (including express).Line 4 is on the ground, and Line 9 is a reasons in the basement, so the length of the transfer is quite long.I used exit 4 when I went to visit my son in the military band that I could visit.There is an unmanned goods locker near the N9.It is a station that can be transferred to Line 4 to transfer and pass on the horizontal escalator/Line 9.There are so many customers who use it during commute time./ It is very easy to use and is good.Long side.It is good to go out of Memorial and Han River.Before that, I didn't see anything special.It is a transit station on Line 4. \ N There is also a national memorial service.Connected to Memorial/Line 9 and 4 The elevator of heaven .../It is very useful as a transit traffic/ㅇFeeling at the old Japanese neighborhood/Subway station is the subway station. What is the subway station?The comfortable station/subway is connected to 4 and 9.",95
23,23,총신대입구역,3.7,"It is a place where Line 4 and Line 7 can transfer to the public transportation subway (railroads under urban land).\ n The road to transfer is far and far ...It is a place that is often used because it is used.The elderly are more confusing and difficult.It can be replaced by Line 4, ride on Line 7,/... The elevator seems to be dead. As you are broadcasting on the subway, you should use an elevator in another exit that survives or survives.It is well formed.The bus is also the same \ N than I thought.\ N \ n1) From Line 4 to cross Line 7 is too far and deep, so you can get it.To go out, it's much more convenient to go to the ground than the basement.Especially if you get off on Line 4, it's a good idea to go out and find it.Please recognize it in advance because you can go to the basement and get rid of it.N2) There is a traditional market next to Taepyeong Department Store, which is cheap, there are a few attractions, and there are famous restaurants.Subway Station/Weekend, there are a lot of users/subway use/subway station.Transfer of Line 4-7./ There are many restaurants and traditional markets around you, so you don't have to worry about food/Subway/Clean and well-organized feeling?.",65
24,24,사당역,4.0,"The station of frenzy where you can taste bean sprouts Shiru hell every time you commute to work and college students.If you don't understand why people buy cars, try using the Sadang Station in the Russian War.Your curiosity will be solved within 3 seconds.Line 2 subway landmark!Those who live in the Gyeonggi area with a transfer station on Line 4 have to change to move to Seocho, Gangnam, and Jamsil.It's a pressed hamburger during the commute Russian Wash.If you go out to Exit 13 and Exit 10, you have an alley.There is also a transit station.It's more steamed than summer.The sweat will be sweating. The worst/diligent person \ nWhen I was flooded with Oseidon about 10 years ago, when I had a heavy snow.All were here.I walked home twice and went home.I learned that I could cross the South Taeryeong.My house was Indeokwon.It is always complicated because there are many stations/users who have a lot of linked buses to Seoul, which can be transferred to the center of public transportation in southern Seoul/365 days, and there are many connected buses from Seoul.In particular, some malls' behavior of the shopping malls makes the eyes of the lines of Line 4 and 2, where people who go to Gwacheon change the bus/Sadang Station 18 minutes, Hongdae 28 minutes, and 14 minutes from Sadang Station.Good hubs/Sadang station exit 5 exit 5.The signboard is wrong/There are a lot of people in the transit station.The transfer is overwhelmed by the line/Sadang Station/Sadang Station/Sadang Station/Sadang Station Shelter/Sadang Station/Transportation Mecca/Lol. \ N long ago, there was a big shrine (shrine) nearby.There are Seoul Education and Training Center, Isu Middle School, and Isu Elementary School.Exit 13.14 There is a food village at Exit 4 No. 4. The journal is connected to Pastel City, and in Pasty City, there are many delicious restaurants such as Symbidium, Gyeongbokgung Palace, etc.It is a passing place.There are a lot of congestion time for commuting time.It is connected to Gwacheon through the Nam Tae -ryeong Pass. ',' I ate pork belly and grilled abbolis at Sadang Station and Rural Myeongga.Naturally, pork belly and abalone seem to be compatible.Naturally, of course. ',' Good transit station \ n things are good \ n2 ride on the riding job of the songsa Budon.It is between the barrel college and Namtaeyeong station ',' I stop by to work.Direction wide -area bus \ n \ n6501 \ n6502 \ n \ n3200 (moving to 30 meters on the right side) \ n3300I always use it '\ n.', 'I took a train going to Sadang Station, but everyone will come down ... I have to change it.This is, 'Line 4 meets a lot of people, and there are many buses to the southern part of the game.'I was going to go home, but the motel becomes full at 9 o'clock because people who are not willing to gather.n can not improve even if I have a few years of experience. 'In particular, he is entangled with taxi and buses.Even though there is a bus late at night, Suwon is a taxi ride next to it.Unnecessary fishing, 'Public parking lot (ground) at Sadang Station Exit 1 \ n Weekend morning and evening tourist bus 1,' Exit 1 of Line 4 ',' Line 4 Transit Station ... ',' Sadang Station. 'Go out to Exit 8 and enter the left -handed alley.In detail, 'Line 4 Transit Station \ N The Line is not long \ N4's stairs are always complicated, \ n \ n's beware of apostles!'Suwon Bundang is a bus ride.KTX buses to Gwangmyeong Station are also close to IKEA Costco.There are many restaurants in Exit 12 and the surrounding restaurant, and there are also Bandien Lunis bookstores.The most famous restaurant is a rural rural back on the pastel city.Starbucks is located in three surrounding places and McDonald Burger King Lotteria.If you go out to Exit 10, Makgeolli Hansa! 'There are cases where you are operating, 'Caution requirements',' The transfer section of Line 2 and 4 is a bus to Gyeonggi -do.It's nice to see.If you use the book self -corner, it is good to order and visit the Internet price more cheaper. '' People are too crowded.During the construction of the store, we have replaced the old leakage breaker with a new breaker.Because of the section, there are quite a lot of floating population.There are many restaurants outside ^^ ',' Traffic is convenient, so it is used a lot as a meeting place '.However, there are so many surrounding commercial areas and restaurants, 'Seocho, the southern part of Seoul, with a lot of floating population.As a station, the mobile population is always full of cold history 'and' The best place for metropolitan meetings.Gas Paldal's Gist.Is there a soup nearby nearby .... ',' Line 2 Transit Station ',' Everyone knows transit station .. \ n2 and 4 are overlapping and there are a lot of passengers. 'A lot of departures and the subway lines 2 and 4 transit stations 'and' Line 2.4 meets.It is a very complicated subway station to the buses to Gyeonggi -do. ''It's a little old and needs remuneration now.So many people use it ',' The gateway to Seoul from the southern part of Gyeonggi for many years .. \ nThis optimized \ n traffic shortage around Sadang Station requires a solution.It is the best cool subway station that reminds me of a new father.Many entertainment businesses around them ',' Transit Station on Line 2 and 4.There are a lot of restaurants around the history ',' Sadang station ',' The transfer area is a lot of crowds. 'I don't lose it, but this is a real transfer hell .., `` I'm a subway station. ''It's so long, it's not a joke to have a good bridge, who's correcting it.I like a lot of toilets, 'Thank you for showing the performance occasionally', 'Always complex', 'It is a traffic center in southwestern Seoul', 'Drinking delicious drinks while waiting', '7800 times','The gateway to the gateway of 'Dongjak -gu, Sindorim in Dongjak -gu', 'There is a tteokbokki restaurant at Sadang Station Exit 1', 'Seoul Metro', 'There are many restaurants', 'complicated station', 'crowded'The best if you take it out, 'the transportation is good', 'I am good to meet people', 'I'm always crowded ~~~~~', 'Complex, clogged and messy'There are a lot of people ... ',' Tong Paldal's pronoun ',' crowded ',' best ',' ㅑ 0 ',' always crowd ',' transit station 'Living Dongne Im ',' 01 ',' Sadang ',' Very crowded ',' Primsy Bokjab ',' Traffic Words', 'Sadang Station Photo Photo', 'Sadang Subway Station', 'Sadang Station', 'crowded', 'transit station', 'Sadang station', 'Like ♡♡', 'The point of transportation ..'It's not a huge station, but it's crowded and wide.Peak commuting time is really congestedIt will be done. ',' I'm very busy at 9 am to 10 am. 'You can board Suwon and Hwaseong Intercity Bus from Exit 4. 'There is a large space in front of Gate 2.1, subway.Is the price appropriate ??',' My favorite station is to visit almost every day. ',' Not bad ',' crowded train station.Where to go, '226/433 Sadang Station', 'Good Shopping', 'Sketch', 'Amazing', 'Sadang']",247
