,Unnamed: 0,statnNm,rating,review,review_count
19,19,116 Street,3.7,"Here, drugs are openly traded, and there are no guards at the subway station, and addicts can open an emergency exit and take the train for free.I never want to drive again in this station./Many drug addicts sell the latest boost items.They need to be careful and self -awareness when they go through the streets as legally, and this must be the most sketch of the subway station I've ever been.Rotate your head here and do not come after dark.Women should be especially careful.There are many homeless and drug addicts outside.Very crowded ./ Be careful when using this station at night.Be careful and safe.It's a bit scary at night ./ The platform is as clean as the New York subway station (not completely dirty), but there are four stars because the indicator of Wi-Fi and the next train will come.This station is crowded while taking the train to Bronx.Except for the day of the week unless you go to work in general?It's amazing because the train station is not crowded at any given time.The service can be slightly improved to alleviate the congestion that occurs in the station to 125th Street.While going in the other direction, there are few people because there are few people after 125th Street to the city.I have been to see how long the social distance sticker is, which can be understood, but now there are no one who actually follows it.The station is relatively clean and natural.I saw employees who kept their places every day or as much as possible, and there was no other complaint about the station as far as I knew.We are planning a project plan for.I love New York. \ N Those who work for possible BLAS? \ N Mention to other countries and shine in. \ N. \ ngoote is working with everyone and New York.I need to see if my friends can do it. \ N Student University Street 116 \ N We need to turn on new lights. \ N We are addicted to New York. \ N God is working here.It is located in the Upper East Side of (Mannhatan), and train 6 is always operated, trains 4 in late night or congestion, and trains 5 for congestion.116th Street is a really quiet station when it is not a Russian.In most cases, it smells fresh, and the neighborhood is not safe.It is better not to do anything at night.And the place is owned and operated by the family.Breakfast, lunch, dinner is delicious ??/Block is always on!Everything you need for hips, skipping, jumping, jumping!There are many places to eat near the station.It's a clean station, but sometimes it can smell pee at the end of the platform.There are also mobile phone services, free Wi-Fi and departure signs.I like it.Food, people, entertainment, culture and knowledge are the best.It was Latin Pre -White Party located at the Great 10x!/115st.And Lexington Ave.July 31, 2021.We had a good time.Subeniles is recommended.In the case of Puerto Rico ISPANOS, banks, 1AVEMALL trains and bus stops near the pharmacy/I have used this station since I was young, but the station was clean and there was no garbage around.But there are so many swipes that bother people to buy swipes./Sast 116th ST is a busy street with many shops and people.It's always crowded, but the subway in Manhattan is quite dirty.7/10 goes into the drug site, but I mean that it is normal.To ride in the necessary direction, use the east of LEXINGTON for the UP TOWN SUBWAY, and Down Town (south direction) Subway.The train comes and goes!There are a lot of pretty neighborhood aunts ??/A good day, a bad day, there are many drug users and garbage around.When you go up or go to the city, get in the right direction.Nevertheless, it is a busy station.On the day, you can learn a lot about shops in this area.It looks like a station (old station)./There's nothing to say here.Do not.But it's okay to do it./It's not very good. Very dirty/Clean and there is always a trash can.This is, the station must be clean/people are lovely?/Good station ???????????????????????????/Good train stop ./ Always late/a little dirty ..",98
20,20,110th Street station,4.0,"This station is becoming a ghetto, and it is safe and lightning well and clean.There is a police officer next to the subway platform and the external token office booth.Canibis to help those who need help ??Please use indica and CBL oil for medical and career treatment !!!…/Excellent station.In the Russian War, many children and teenagers gather in this role.The clicking sound of the express train can sometimes be noisy.There is also a mobile phone service and a free Wi-Fi, and there is also a start-up sign.I'm depressed.It is just another dirty station that needs to be cleaned below the average station.Trains and buses 2, 3, 4, 5, 6 are within the safe access range of our community.It is important to me because I carry a stroller.The station is on the 110th Avenue and Lex AVE of the upper Eastside./90's crazy broadcasting station, the entrance very close to the calmness/train is now.Not pretty but very functional.Go to the right of the street.Uptown trains are on the east and the uptown train is east.LEXINGTON AVE, downtown.There's a bench towards the wall/it's excellent and it's really close to Central Park.All in order/6 trains may be much better/I love this area.Horrible",77
21,21,103rd Street station,4.2,"It's a small station, but it's great and clean to ride a train on the region.This feels safer because it looks cleaner than anything else and has employees.Not often.The train runs to the city and there are not many on weekends.It is only one stop distance from the express train 96.When it rains, the station hall is often submerged in water, so bring the right shoes.It was clean and there were many people, but not crowded.It is connected to No. 1 train that takes us all over the city.Even at 5 am, I felt safe here.Tips for visitors: It's much easier to take a train from the front or back of the station.If you are in the middle of the staircase during the commute time, it is difficult to board, especially if you have a lot of people.103th Street is a simple, convenient and clean station.Sometimes two or three trains can be used if there is a problem with a general route on other routes.If this happens, two or three trains will be terminated at 137th St-City College.There is no elevator, but you can change the direction on Line 1./I like this station and line 1.I go to work safe and early./ It's clean, but the MTA is not two trains on the uptown and downtown side, but the next four trains must be updated to the next four trains.It is not easy to cross the street.The advantage is that the employee is in the field./I think this subway station has played the role of subway station properly ./ The basic station can use updates.We do not comply with ADA./ A good small station.But it achieves that purpose/This is very busy/Cool station/Bench is attached to the wall/Amani Bora, Amani Vesta./ I like this subway station !!!!! ??????/Very neat/not clean/dark/solid 1 stop ./ Cave/It's my stop",83
22,22,96th Street,4.1,"The subway station is wide and clean!/It's a new station.Very artistic and modern.There are many seats for the waiting room.Residential areas with coffee shops and Delhi restaurants around me.The end of the East Harlem moved from one place to another, as if the general station/subway station of East Harlem/UES was created.Follow me all over the Internet: You must dismiss one of the booths of the 96th Route No. 66 in the Internet.He saw that I went into unlimited and walked the streets to bring an umbrella from the workplace.He did not even allow me to enter the system without waiting for 18 minutes.There is no help or courtesy at all.It is disgusting customer service and action, but it is not surprising in that it is MTA.If you do not want to sit in the platform area, the seat space on the track.I hope all the trains are made that way.It's not ADA standard, but there's a Wi-Fi and cellular service in the station.Very artistic and modern.There are many seats for the waiting room.Metropolitan Hospital is one block away.Residential area with coffee shops and Delhi restaurants around.Since it is a local route, you can change to uptown at 86th St. on an express downtown or 125th st..This location is not the Second Ave Q.This is not the Q train of the secondary line.This is the 6th of the Lexington Avenue line.Honestly, how do you don't know where to review and review your place?96th Reverse Q Train, especially early morning, not a lot, and later, many homeless people are sleeping, but the worst is the smell.It's crowded, but it's okay to go to the city, go to downtown, uptown, or ride a train.If you are not good at health avoid it!/It's similar to a train, but there's a long distance to walk from home.And safe subway station/is okay.There are many people from various places, so it can sometimes be dirty.Elevator consciousness support.There is a graffiti there/very safe and clean/bad place.I saw a better place.The subway is better for the 2nd Avenue.Honestly, I saw better./ The northeast staircase is always being repaired and the water leaks at the station when it rains./ Beautiful, nice and clean subway./ 6 trains I miss to live one block from a place where I often go.There aren't many.Historic place of history.It's not a express stop./I live on 97th Street.Morningside Heights is clunky and noble.It is the original UWS, but the jazz club and the unusual business have been replaced by the city's ""service"" customers and an effort to do not add texture to the neighbors.It's pretty clean or at least covered with garbage, shit, and urine.There are no wonderful murals like 86, 81, 72.SOLID 4!Inexperienced characters are allowed to roam on the subway platform and there is no security for safety.If you need help, make your own decision.There is only one automatic seller who can buy MetROCARD.Stairs and stairs require maintenance.The staircase and staircase should be wider so that they can accommodate a lot of traffic during commute time.Woo -Ho Ho \ n is working/convenient station that connects a lot of clean and many lines.It runs here from 5:00 to 10 pm.Train B runs only on weekends, and trains A operate only at night.",134
23,23,86th Street,4.2,"Friendly staff.Good products/This subway offers both express train (4,5) and local train (6) uptown and downtown.The Internet works pretty well.Express trains are downstairs, usually on the first platform.In general, it is one of the busiest stations of Line 6.This is because it offers three train lines.Connect to many items for the M86./ Someone starts work ... much better maintenance !!!! -This was a few -months ago.It was really a disaster ... the trash can slightly tilted ... The food was all messed up., An old paper bag containing a broken bottle ... Homeless group is sleeping ... Let's see the whole picture?It will be clean and safe!/Commuting time/at night, it's quite rough, but if I say that, I play a role well.It is partially accessible in that the elevator goes down to the uptown area.There is also a wonderful art work.""This is the express stop of the LEXINGTON Avenue Line with LEXINGTON Avenue.If you have to miss the stop and go back, there is no excess pass.You have to pay again.There were many places to shop in this area.In the case of clothes, the elevator is only on the uptown side of the station.But there's a clean and there's a seat in the station.There is no free transfer to the other side, as you go back to downtown.Express is 15 to 25 minutes faster from 86th Street to Bowling Green.Many people always go to downtown or Bronx.Sometimes there are so many people that it is difficult to ride on the train.The station is currently under construction.However, sometimes the path is changed on the stairs.The station is very clean but does not comply with ADA.M86 +SBS +./How do you put this?It's an old subway station.It smells dark and hot and is usually unpleasant.However, since it operates 4, 5, and 6, it usually has an uptown or city train within 3 minutes after arrival.Harlem has only one stop, Grand Central is two stops, and the Atlantic Terminal is located at 10 stops.Overall, it may not be as good as next door to Q, but the service is usually pretty good./ The environment is pleasant and there are many convenience stores nearby.In this area, there are many bank branches, fast food franchises, uptowns and downtown subway entrances, and you can easily access the Croatte bus located at the corner of the E86th Street with Lexington AVE./Genera LLC will drive 24 hours a day a day 24 hours a day.It is a professional driver service that provides a driver.I'm talking about uptown.excellent.Avoid children who are coming to the sound at 3:30 pm.They are New Yorkers.They just screams, and they are always too crowded.Wait 5 minutes.Not crowded.The place I stopped was 86th.When I went back, I used subway line 6.I wait for less than 5 minutes.Wearing a number of passengers/inputs separated in different directions is not a good idea.The space is small, but the line is great./ New York subway is very old.The operation is very bad and the train is not often operated.We are not ready for those who are uncomfortable (there are few elevators).It is very expensive at $ 2.75 per tonsil.In some stations, access to the platform is impossible, so you have to cross the road from the ground.I was very disappointed.I didn't expect this much./ It's actually one of the better subway stations.It's relatively clean.Construction workers with parking lots.The restaurant has captured the distance around the block :/LEXTINGTON IRT to get off from this station on this station, you must board one of four, five or six local six train routes.Especially during the peak time zone, 4 ~ 5 trains are recommended.When boarding from this station, the entrance to uptown and the city is crossed across each other, and there is no connected access point, so if you accidentally go to the city, you should pay an additional fee.If you need to go out and swipe again with uptown, there are many shops (MTA Metro Cards)/There are many shops and places where you can relax and eat.There is a gift stand.I used 5 EXPs to WTC.It took 20 minutes.That's good!It is in a very convenient position.If you live nearby, I will use the station often.There is no problem with train No. 6.It was as scheduled./86th Street 4 5 and 6 Trains/Likes ... There are many shops ... There are many shops .../Q train has an elevator and escalator that goes down to the rotation door.It is not synchronized./It is recommended that you have a place to choose a good food over there and shopping shops.Here, there are a lot of fare eviders.It is a relatively clean subway station in New York.Wait 2-3 minutes…/I don't like this station at all.The staff working in the booth are very rude.ah!And be careful of where it comes from.If you don't pay the cost of the fair again, you can't change the direction.There are signs that will help you to guide the time to come and go out of the train./ I love this place/subway station ??/There is not much to see, only lazy people, bothers people who pass by/not too gorgeous or too shabby.It's a good/beautiful/quiet place/The train station is too humid and too many people, so it's almost impossible to board the train without bumping with people.????…/Sometimes it's crowded, but thank you for the carefully selected bus service./ A good place to visit!There is nothing that can be transferred inside, and you have to go out and cross the road again.Seriously crowded place.Then the express train stops here ... Sometimes.elevator…/??…/Good stop -express and region -Easy to move between bidirectional and both directions./Too many people.There is a lot of construction, not unipn -not good ....../Very good and kind/okay.I've always been busy on train 4./ Typical New York Subway .../It's a great place to go to the Metropolitan Museum of Art./ New York Subway.The price is expensive and the quality is low.Run!/It is convenient and convenient in various locations./ A nice place to take the train/good place!Station/Very Clean/Visit New York Central Park./Very crowded and slow trains/Good station/very clean/like other MTA stations/UE center/103 walks to 103/atmosphere Upper Eastside Station/Stylish/Good Transportation/Good/Good/MTA/I hate/It's so natural ../ Fresh/disgusting/avoid/86th Street Street/Fine Station/New York Subway/Very Clean Little Clean Station.I have no problem with it.",259
24,24,77th Street station,3.9,"We have some crush on this station.She is our first person in New York.It's quite old, it's a bit left, and sometimes it looks like a public toilet.The entrance is shabby and flat, but when you go out to the exit, the New York will spread out in front of you./Modernization is required, but it is stored well.There is a lack of benches and air conditioners.Free Wi-Fi is an advantage.Lenox Hill Hospital is also nearby:/There is a busy station next to a busy hospital and no escalator or elevator.Food and service are always great.Today we ate a custom Alfredo Carbonara Lingui with vodka pen and chicken.It was great.We were happy with our choice.If you are nearby, we recommend Caffe Buon Gusto.My picture shows Linguini Carbonara Alfredo source.Everything is perfect!/Very clean subway stop.This will be the stop of Lenox Hill Hospital.(In preparation for emergency situations). \ N \ nThere is a pretty tiling art in the station to the city.Located on the side, trains 6 are always operated in this beautiful station, trains 4 are operated at night and congestion, and trains 5 are operated for congestion.77th Street is a really good station, but sometimes it is sold like a locker room, so there are times when you commute to work.It is slippery when it rains.People running towards the train.There was no elevator/steak and ribs and were excellent, but the company was better.The MTA staff in Uptown pays the second cost.It takes a long time for the train to pass and is very full ??????/I can't help but admire the beauty of Manhattan Street.I'm going to go back to my homeland soon, but I already miss this street. \ N ???????????/MTA is as good as it is.Of course, this will only happen in the richest areas.Let's take the subway.Here is also Wi -Fi ./lexington Avenue Subway Station Line 6.If you are heading to SummerStage, this will go together./ dirty/This stop is very pleasant!/Clean and safe/Good for tourists.????????????/Clean subway/minister",59
25,25,68th Street­Hunter College station,3.3,"It's not the most aesthetically enjoyable station you can see with your eyes.But it is still a subway station where trains operate quite a pretty good frequency.Never wait for more than 20 minutes./ Another wonderful subway station!Enjoy a lovely seating space in a nice round bench (which seems to be modern) just opposite the MTA office booth. \ NMTA staff is usually very helpful.Remodeling is required.And check out the bulb! \ Nmta has done amazing work to replace all the bulbs in the last few years, and many bulbs have been replaced by MTA.How many bulbs are there around @mta MTA? \ N Tip MTA distributes masks for free. \ n Tip: Be careful to see if the police are blocking people.Just ask.Perhaps they will help you.But sometimes you come here.However, when you are on the Hunter College, it is difficult to refuse it easily to transfer to Line 6 when you are on Line 4 or 5.If you pass the ticket gate, there is a waiting space with a seat.There is an entrance to Hunter for students, but I have never used it.I climb the narrow staircase from the middle floor to the first floor.There is no name or tag and a brown bag has a long strap.1 pm in April @exactly at 9:16 pm/I started seeing things here that I couldn't see on the subway for a long time.And it's not good.What happened in our city?The location may be convenient, but the narrow exit of Line 6 and the high passenger boarding rate means that going out of the subway station can be a very painful experience.If possible, try a new Q station.No, but it's crowded than other stations, so it's good for safety.However, there is no toilet in this station./68 Street-Hunter College is located in the Upper Eastside of Mannhatan, conveniently located near Hunter College, and is really open when waiting in the center of the platform.Trains 6 are always operated in this station, and trains 5 are operated in late night and congestion and trains 5 for suspension.Hunter College is a blue support pillar, and sometimes it smells good.This is not good, it is expected to be pushed and trampled, and the streets, birds are under construction.Instead, it's much happier to use a new Q line ./ Some tiles look a bit messy.Some tiles are missing and the floor looks messy.One man rode six garbage bags full of plastic bottles./ The only thing I like at this station is the underground entrance of Hunter College./It is convenient only when you go to Hunter, and it is directly connected to the building so you don't have to see the light during the day./ The train service is great, but it doesn't look very good at itself.(Rebuilding will begin in 2017.)/One of the best universities in New York City/this station is a trap of death.Too many people are flowing through two exits without equipment to handle the amount.I ruined everything and never wanted to go again because of the discrimination and unkind service employees.They have recently added WiFi to this station!/MTA Line 6 require a solution to overcrowding problems!/Do you know whether there is an elevator?Please let me know ../Do you think the good station is closest to the zoo?/New York's station is dirty!/Good/Clean Station/Okay.Keep continuing to the next",73
26,26,59th Street station,3.8,"I got off at the 59th st 4 Ave at the Brooklyn subway station to transfer from the R train to the N train.Because R trains will take more than 20 minutes with local trains.The N train is an express train and two stops are nearly 10 minutes away from Atlantic Ave Barclays Center.Transfer is very convenient without climbing the stairs.Express trains usually save time than ordinary trains.The waiting time is usually not long.5-15 minutes.The station is relatively clean compared to other stations in New York because there are almost no garbage on the floor.This station has been a transit point for my trip for many years./ When waiting for an N train early in the morning, rats can see the foods that have been abandoned under the garbage.It's a fun way to spend time while waiting./ The recent modernized part of the station is very clean and bright light, including a new elevator.Old areas are a bit dirty, dark and depressed.R and N trains are running quite well.At the entrance of the distance 60, there are only MTA machines and most work.If the dam is uncomfortable, you have to walk to the entrance of the 59th Street.It is dark, smells, and homeless rules and trains do not operate properly.You can see active snipers on this line now.But those who travel here have more control over cleanliness than the MTA.If the trash can be too far to cry loudly, pick or take garbage!But it's much better than ever.This place is generally safe and okay, but it can be very hot and sweaty, so you may need to use a little vent.In detail/in the morning commute time, the Q train stops here.I was looking forward to what I knew about Valencia cake.This is not the case.First of all, icing is a sweet, bright and shining white.The flowers were almost as bright as neon like a bright food color.Originally, the cake was sweet, but it wasn't like this.Originally, Valencia Cake had white frosting and the flowers were bright but not too bright as neon.The cake was not fresh and was very poor in copying the original.If the reader knows the true original Valencia cake, my advice is that I don't want to save money and fall into great disappointment.It is a good transit station between the train and the N (express) train.This place is generally safe and okay, but the bottom can be really hot and sweaty, so you may need to use a little vent.Nonsense/This station is convenient for riding N and R trains.Sometimes homeless people are sleeping on the chair and the floor.It's pretty warm in winter and cool in summer.Many students take a train from the N train here.Manhattan commute time is from 7:30 to 8:30.The station is clean but not as new as it is ./ This picture was like a ghost city when the fan Demick began, but now it has begun to return to normal.Too many bums and skeletons are constantly playing this stop to play around and harass someone.N and R trains take time to arrive.I think there will be an elevator soon, but I'm clapping with one hand!I hope the elevator for wheelchairs and strollers will be installed quickly!/Good service than 35 years ago.You can clearly hear the message.There is a food court on the first floor and there are various places on the outside.The R train to the north usually uses a switch late at night until November 4, 2016, and this switch stayed locally on WhiteHall Street./Invited, friendly and acceptable.And this station is the same as other stations: I'm upgrading the station, but if you ask me, it's still pretty dizzy./ The good/place is beautiful, but people are not..Everything is close to me.There was no snack/train station/yesterday booth.I had to go to 53th Street to find the reverse booth.That's it .../Well, this is a good place, and it's a good place, it's a normal place for many people.The train is so slow and delayed every day and delays ./ Wi-Fi or mobile services are not provided yet.The interior is a bit cluttered/distant bath ../ tear.Mikey Brown.I can't forget/Thank you for your service/Wi-Fi is needed./ The subway is dirty and needs to be maintained../ There is always a problem with the service/the train has not come/this is not a fan./No complaint/Perfect station/Good/dirty ...",24
